{
  "baseline": {
    "backend": "jax-jit",
    "counts": {
      "compilation_failure": 0,
      "dtype_mismatch": 0,
      "environment_failure": 0,
      "execution_failure": 0,
      "inconclusive": 0,
      "invalid_workload": 0,
      "nondeterminism": 0,
      "numerical_discrepancy": 0,
      "pass": 13,
      "performance_regression": 0,
      "shape_mismatch": 0,
      "timeout": 0,
      "unsupported_backend": 0
    },
    "execution": {
      "platform": "Windows-11-10.0.29683-SP0",
      "requested_platform": "cpu"
    }
  },
  "comparison": {
    "backend": "jax-gpu-jit",
    "counts": {
      "compilation_failure": 0,
      "dtype_mismatch": 0,
      "environment_failure": 0,
      "execution_failure": 0,
      "inconclusive": 0,
      "invalid_workload": 0,
      "nondeterminism": 0,
      "numerical_discrepancy": 0,
      "pass": 13,
      "performance_regression": 0,
      "shape_mismatch": 0,
      "timeout": 0,
      "unsupported_backend": 0
    },
    "execution": {
      "cuda_visible_devices": "0",
      "physical_device": {
        "compute_capability": "7.0",
        "cuda_ordinal": 0,
        "cuda_version": "13.0",
        "driver_version": "580.178.04",
        "name": "Tesla V100-SXM2-16GB",
        "nvidia_smi_index": 0,
        "runtime_ordinal": 0,
        "uuid_redacted": "dev-7562ed358f6c"
      },
      "platform": "Linux-7.0.0-38-generic-x86_64-with-glibc2.43",
      "requested_platform": "gpu"
    }
  },
  "comparison_version": "metamorphic-cross-backend-v1",
  "corpus_version": "1.0",
  "interpretation": "Equivalent classifications apply only to the checksummed workloads, seed, policies, and backends recorded by these two artifacts.",
  "properties": [
    {
      "baseline_classification": "pass",
      "classification_match": true,
      "comparison_classification": "pass",
      "identifier": "add-commutativity-v1",
      "left_workload_sha256": "f30c6ca7efc657284b4c2bfc9b19bdfe2529f1cb4c7f2e86f8fe051d5b3f5117",
      "right_workload_sha256": "f7bdc9ef963786c129acff40051891b4e4307f127e2b9a81219be2e56c76a923"
    },
    {
      "baseline_classification": "pass",
      "classification_match": true,
      "comparison_classification": "pass",
      "identifier": "transpose-involution-v1",
      "left_workload_sha256": "d1154fa844d5a82189845e52cbf1681f66c84c0538632243c42f1f862d4e1e72",
      "right_workload_sha256": "13deba9a38ba92f1dc2b7048d49d796b8187f7305dacddb2adb01fb491c8d1a4"
    },
    {
      "baseline_classification": "pass",
      "classification_match": true,
      "comparison_classification": "pass",
      "identifier": "reshape-roundtrip-v1",
      "left_workload_sha256": "8d68c21cf55434a56ce4a8077de8bc03bb5b3084c994f923acd29a05b0569fc5",
      "right_workload_sha256": "811fd9752155cece7b9307e8e1b34b56a3340b83bbff5a9231383b1532db53e7"
    },
    {
      "baseline_classification": "pass",
      "classification_match": true,
      "comparison_classification": "pass",
      "identifier": "matmul-transpose-v1",
      "left_workload_sha256": "abd2c2b1dc31d74e4b91a9890ab379a486b1cd2bfbcf1845806560843eecb3b1",
      "right_workload_sha256": "53dc2f56593ac9628f77c3116ba4d277adecaeb651135467a96c4e8f93526b74"
    },
    {
      "baseline_classification": "pass",
      "classification_match": true,
      "comparison_classification": "pass",
      "identifier": "negation-involution-v1",
      "left_workload_sha256": "942886dc3179927780a832fbb7b69f36c3e0c052f2b85c150942ac62fe16892f",
      "right_workload_sha256": "0f43e35c7ea628ed597b9ea54dec0c88f3358a79580c3a2db09c997148f62382"
    },
    {
      "baseline_classification": "pass",
      "classification_match": true,
      "comparison_classification": "pass",
      "identifier": "subtraction-as-addition-v1",
      "left_workload_sha256": "825d19ba1463510dae57ec27c5972937e60fedc26344d3390c1a28036205c53e",
      "right_workload_sha256": "b20c0680cd6b85d9e76126f432112f5f71f2795be41b69c5bbd16847950786ba"
    },
    {
      "baseline_classification": "pass",
      "classification_match": true,
      "comparison_classification": "pass",
      "identifier": "absolute-idempotence-v1",
      "left_workload_sha256": "238f19267665682ff1601a56e7f953f49b253ce93ef03bee20d13389360b3709",
      "right_workload_sha256": "111e9ff91cbaa4538c6b44992fa7f9efa364df038dd54099f5d83ce50e0fb1d5"
    },
    {
      "baseline_classification": "pass",
      "classification_match": true,
      "comparison_classification": "pass",
      "identifier": "integer-add-commutativity-v1",
      "left_workload_sha256": "1d2050aea44a098a6fada73dca4521b6e1ea4defe9a773b64f30d0c40b1281d9",
      "right_workload_sha256": "8c95fc161d3082f0ed14f0b74646eb5e6a65c4edcc7a2ea0e50971eb33e800e0"
    },
    {
      "baseline_classification": "pass",
      "classification_match": true,
      "comparison_classification": "pass",
      "identifier": "float64-add-commutativity-v1",
      "left_workload_sha256": "71f51f56bfe65ef9c4baae4df2bb2f817757d4cb1b9323085436b968e1638e5f",
      "right_workload_sha256": "6ceaed4e1570d3a67a3c095b321eba15468a49231b0bb3a614224006bd3a244b"
    },
    {
      "baseline_classification": "pass",
      "classification_match": true,
      "comparison_classification": "pass",
      "identifier": "mixed-dtype-add-commutativity-v1",
      "left_workload_sha256": "24d3573056dbcb1b7f43900cc7e637f4686178ddef724868202a41b3ccfe42d2",
      "right_workload_sha256": "ef147cdb1b20adfc40ba95329cb51c1fc281398adbd2c679b8700ebce107b6e2"
    },
    {
      "baseline_classification": "pass",
      "classification_match": true,
      "comparison_classification": "pass",
      "identifier": "signed-zero-negation-involution-v1",
      "left_workload_sha256": "3b9be5a5eed677d1a0ef35bc48bc09fa311a946c27afae6265eb4e0ff19e623c",
      "right_workload_sha256": "dcfcaf0ebb9f5116ed2112d78e362333632872c88f89b7cbef91ac436fe2fc09"
    },
    {
      "baseline_classification": "pass",
      "classification_match": true,
      "comparison_classification": "pass",
      "identifier": "nonfinite-absolute-idempotence-v1",
      "left_workload_sha256": "ca548c11295c89b846da74f8a04420a97277370ae05b32d241f2d2a5fc5c4557",
      "right_workload_sha256": "0f31b361ff73201b26adadd92d4e07b529148d2bc87e90a037405db576d34c58"
    },
    {
      "baseline_classification": "pass",
      "classification_match": true,
      "comparison_classification": "pass",
      "identifier": "extreme-finite-absolute-idempotence-v1",
      "left_workload_sha256": "bb4c89b76d496900c1482d397b2932d2da18c493e62986afefb8ee5bd14a43d9",
      "right_workload_sha256": "800eb9b3a2344dc232252cb2ecc57457eed9dfe5e7164712537ff9202e3aca69"
    }
  ],
  "seed": 0,
  "summary": {
    "changed_properties": [],
    "classification_changes": 0,
    "classification_matches": 13,
    "equivalent": true,
    "property_count": 13
  }
}
